{
  "metadata": {
    "schema_version": 1,
    "season": "2627",
    "gameweek": 5,
    "generated_at": "2026-08-20T06:00:00Z",
    "n_draws": 2000,
    "n_players": 6,
    "bonus_method": "empirical_conditional_bucket",
    "bonus_tail_claim": false,
    "goal_minute_model": "uniform_1_90",
    "substitution_count_exact": false,
    "dgw_rotation_correlation_modelled": false,
    "fpl_rules_source": "signed_yaml_only",
    "fpl_rules_degraded": false,
    "unmodelled_chips": [],
    "parameters": {
      "events.rate_shrinkage_per90": 450.0,
      "minutes.doubtful_default": 0.75,
      "minutes.injured_default": 0.1,
      "minutes.minutes_shrinkage": 2.0,
      "minutes.news_staleness_days": 21.0,
      "minutes.p60_shrinkage": 0.75,
      "minutes.start_shrinkage": 0.75,
      "minutes.substitutes_per_fixture": 4.14
    },
    "required": false,
    "sample": true,
    "sample_note": "A trimmed real artifact covering every player state a consumer must handle: a single fixture, a double gameweek (two match ids, summed on the same draw index), and a blank (present with xp 0 and no fixtures, never omitted)."
  },
  "fixtures": [
    {
      "match_id": "m1",
      "home_team": "Alpha",
      "away_team": "Beta",
      "kickoff": "2026-09-12T14:00:00Z",
      "lambda_home": 1.6,
      "mu_away": 1.1
    },
    {
      "match_id": "m2",
      "home_team": "Beta",
      "away_team": "Gamma",
      "kickoff": "2026-09-15T19:00:00Z",
      "lambda_home": 1.4,
      "mu_away": 1.2
    }
  ],
  "players": [
    {
      "element_id": 1018,
      "fixtures": [
        "m1",
        "m2"
      ],
      "n_fixtures": 2,
      "blank": false,
      "xp": 6.523,
      "xp_sd": 3.6947897098481803,
      "p_appears": 1.0,
      "p_60": 1.0,
      "e_minutes": 179.5055,
      "e_goals": 0.068,
      "e_assists": 0.0735,
      "p_goal": 0.066,
      "p_multi_goal": 0.002,
      "p_clean_sheet": 0.438,
      "p_ge_2": 0.9575,
      "p_ge_5": 0.6415,
      "p_ge_10": 0.1995,
      "p_ge_15": 0.0245,
      "q10": 2.0,
      "q50": 6.0,
      "q90": 12.0,
      "q99": 16.00999999999999,
      "mc_se": 0.08261800953787254
    },
    {
      "element_id": 1019,
      "fixtures": [
        "m1",
        "m2"
      ],
      "n_fixtures": 2,
      "blank": false,
      "xp": 6.446,
      "xp_sd": 3.6580164023689123,
      "p_appears": 1.0,
      "p_60": 1.0,
      "e_minutes": 179.5535,
      "e_goals": 0.072,
      "e_assists": 0.055,
      "p_goal": 0.0685,
      "p_multi_goal": 0.0035,
      "p_clean_sheet": 0.438,
      "p_ge_2": 0.9565,
      "p_ge_5": 0.634,
      "p_ge_10": 0.19,
      "p_ge_15": 0.0275,
      "q10": 2.0,
      "q50": 6.0,
      "q90": 11.0,
      "q99": 16.0,
      "mc_se": 0.0817957333850611
    },
    {
      "element_id": 1000,
      "fixtures": [
        "m1"
      ],
      "n_fixtures": 1,
      "blank": false,
      "xp": 3.889,
      "xp_sd": 2.8329629365736504,
      "p_appears": 1.0,
      "p_60": 0.9935,
      "e_minutes": 89.6295,
      "e_goals": 0.052,
      "e_assists": 0.0385,
      "p_goal": 0.051,
      "p_multi_goal": 0.001,
      "p_clean_sheet": 0.3375,
      "p_ge_2": 0.777,
      "p_ge_5": 0.383,
      "p_ge_10": 0.0285,
      "p_ge_15": 0.0005,
      "q10": 1.0,
      "q50": 3.0,
      "q90": 8.0,
      "q99": 12.0,
      "mc_se": 0.06334697703916108
    },
    {
      "element_id": 1001,
      "fixtures": [
        "m1"
      ],
      "n_fixtures": 1,
      "blank": false,
      "xp": 3.8895,
      "xp_sd": 2.8536449936878974,
      "p_appears": 1.0,
      "p_60": 0.9975,
      "e_minutes": 89.7995,
      "e_goals": 0.0545,
      "e_assists": 0.0385,
      "p_goal": 0.053,
      "p_multi_goal": 0.0015,
      "p_clean_sheet": 0.3375,
      "p_ge_2": 0.7735,
      "p_ge_5": 0.385,
      "p_ge_10": 0.0315,
      "p_ge_15": 0.001,
      "q10": 1.0,
      "q50": 3.0,
      "q90": 8.0,
      "q99": 12.0,
      "mc_se": 0.06380944189538096
    },
    {
      "element_id": 1002,
      "fixtures": [
        "m1"
      ],
      "n_fixtures": 1,
      "blank": false,
      "xp": 3.9415,
      "xp_sd": 2.8802912613136886,
      "p_appears": 1.0,
      "p_60": 0.998,
      "e_minutes": 89.858,
      "e_goals": 0.055,
      "e_assists": 0.0415,
      "p_goal": 0.0535,
      "p_multi_goal": 0.0015,
      "p_clean_sheet": 0.338,
      "p_ge_2": 0.7755,
      "p_ge_5": 0.3845,
      "p_ge_10": 0.033,
      "p_ge_15": 0.002,
      "q10": 1.0,
      "q50": 3.0,
      "q90": 8.0,
      "q99": 12.0,
      "mc_se": 0.06440527055296018
    },
    {
      "element_id": 999001,
      "fixtures": [],
      "n_fixtures": 0,
      "blank": true,
      "xp": 0.0,
      "xp_sd": 0.0,
      "p_appears": 0.0,
      "p_60": 0.0,
      "e_minutes": 0.0,
      "e_goals": 0.0,
      "e_assists": 0.0,
      "p_goal": 0.0,
      "p_multi_goal": 0.0,
      "p_clean_sheet": 0.0,
      "p_ge_2": 0.0,
      "p_ge_5": 0.0,
      "p_ge_10": 0.0,
      "p_ge_15": 0.0,
      "q10": 0.0,
      "q50": 0.0,
      "q90": 0.0,
      "q99": 0.0,
      "mc_se": 0.0
    }
  ],
  "diagnostics": {
    "n_draws": 2000,
    "n_fixtures": 2,
    "n_fixtures_skipped": 0,
    "skipped_fixtures": [],
    "n_players": 55,
    "n_double_gameweek_players": 18,
    "n_blank_gameweek_players": 1,
    "seed_entropy": 7,
    "dgw_rotation_correlation_modelled": false
  }
}
